[
  {
    "id": "warden_bolt_throw",
    "displayName": "Bolt Throw",
    "character": "warden",
    "rarity": "common",
    "type": "attack",
    "cost": 1,
    "target": "enemy",
    "tags": ["damage"],
    "rulesText": "Deal 8 damage.",
    "effects": [
      { "op": "deal_damage", "amount": 8 }
    ],
    "upgrade": {
      "displayName": "Bolt Throw+",
      "rulesText": "Deal 11 damage.",
      "effects": [
        { "op": "deal_damage", "amount": 11 }
      ]
    },
    "balance": {
      "role": "Simple common attack above starter rate."
    }
  },
  {
    "id": "warden_brace",
    "displayName": "Brace",
    "character": "warden",
    "rarity": "common",
    "type": "skill",
    "cost": 1,
    "target": "self",
    "tags": ["block", "time"],
    "rulesText": "Gain 7 Block. If you have 2 or more Time, gain 2 additional Block.",
    "effects": [
      { "op": "gain_block", "amount": 7 },
      {
        "op": "conditional",
        "condition": { "resource_at_least": "time", "amount": 2 },
        "then": [{ "op": "gain_block", "amount": 2 }]
      }
    ],
    "upgrade": {
      "displayName": "Brace+",
      "rulesText": "Gain 9 Block. If you have 2 or more Time, gain 3 additional Block."
    },
    "balance": {
      "role": "Rewards basic resource setup without being dead alone."
    }
  },
  {
    "id": "warden_rewind_spark",
    "displayName": "Rewind Spark",
    "character": "warden",
    "rarity": "uncommon",
    "type": "skill",
    "cost": 0,
    "target": "none",
    "tags": ["draw", "rewind"],
    "rulesText": "Choose 1 card from your discard pile and put it on top of your draw pile. Exhaust.",
    "effects": [
      { "op": "choose_from_discard", "count": 1 },
      { "op": "move_chosen_to_draw_top" },
      { "op": "exhaust_self" }
    ],
    "upgrade": {
      "displayName": "Rewind Spark+",
      "rulesText": "Choose 1 card from your discard pile and put it into your hand. Exhaust."
    },
    "balance": {
      "role": "Skill-testing utility card.",
      "risk": "Can become too strong with high impact rares."
    }
  },
  {
    "id": "warden_overwind_engine",
    "displayName": "Overwind Engine",
    "character": "warden",
    "rarity": "rare",
    "type": "gear",
    "cost": 2,
    "target": "self",
    "tags": ["time", "scaling"],
    "rulesText": "At the start of your turn, gain 1 Time. The first time you spend Time each turn, gain 3 Block.",
    "effects": [
      {
        "op": "add_gear",
        "gear": {
          "id": "gear_overwind_engine",
          "triggers": [
            {
              "when": "turn_start",
              "effects": [{ "op": "gain_time", "amount": 1 }]
            },
            {
              "when": "first_time_spent_each_turn",
              "effects": [{ "op": "gain_block", "amount": 3 }]
            }
          ]
        }
      }
    ],
    "upgrade": {
      "displayName": "Overwind Engine+",
      "rulesText": "At the start of your turn, gain 1 Time. The first time you spend Time each turn, gain 5 Block."
    },
    "balance": {
      "role": "Build-around rare.",
      "notes": "Slow on the turn played, strong over long fights."
    }
  }
]
